2025-12-08 14:56:53 - INFO - Initialized logger for instance: More Machines
2025-12-08 14:56:53 - INFO - Run ID: More Machines_20251208_145653
2025-12-08 14:56:53 - INFO - ============================================================
2025-12-08 14:56:53 - INFO - Starting branch-and-bound solver
2025-12-08 14:56:53 - INFO - Problem: {'n_job_types': 4, 'machines': 4, 'budget': 15, 'prices': [3, 4, 2, 5], 'durations': [6, 8, 4, 10], 'max_nodes': 100000}
2025-12-08 14:56:53 - INFO - ============================================================
2025-12-08 14:56:53 - INFO - Computing initial heuristic solution...
2025-12-08 14:56:53 - INFO - ==================================================
2025-12-08 14:56:53 - INFO - NEW INCUMBENT: 12.0
2025-12-08 14:56:53 - INFO - Selection: [5, 0, 0, 0]
2025-12-08 14:56:53 - INFO - Found at node: 0
2025-12-08 14:56:53 - INFO - ==================================================
2025-12-08 14:56:53 - INFO - Starting branch-and-bound with max_nodes=100000
2025-12-08 14:56:53 - INFO - Initializing CeilKnapsackSolver with reversed item order...
2025-12-08 14:56:53 - INFO - CeilKnapsackSolver initialized successfully
2025-12-08 14:56:53 - DEBUG - Node 1: {'depth': 0, 'occurrences': [0, 0, 0, 0], 'remaining_budget': 15}
2025-12-08 14:56:53 - DEBUG - Bound computed: 22.00 (ceil_knapsack_dp) at depth 0
2025-12-08 14:56:53 - DEBUG -   -> DP solution (remaining): 22.00
2025-12-08 14:56:53 - DEBUG -   -> Already committed: 0.00
2025-12-08 14:56:53 - DEBUG - Node 2: {'depth': 1, 'occurrences': [0, 0, 0, 0], 'remaining_budget': 15}
2025-12-08 14:56:53 - DEBUG - Bound computed: 18.00 (ceil_knapsack_dp) at depth 1
2025-12-08 14:56:53 - DEBUG -   -> DP solution (remaining): 18.00
2025-12-08 14:56:53 - DEBUG -   -> Already committed: 0.00
2025-12-08 14:56:53 - DEBUG - Node 3: {'depth': 2, 'occurrences': [0, 0, 0, 0], 'remaining_budget': 15}
2025-12-08 14:56:53 - DEBUG - Bound computed: 10.00 (ceil_knapsack_dp) at depth 2
2025-12-08 14:56:53 - DEBUG -   -> DP solution (remaining): 10.00
2025-12-08 14:56:53 - DEBUG -   -> Already committed: 0.00
2025-12-08 14:56:53 - DEBUG - Pruned (bound_dominated): {'depth': 2, 'occurrences': [0, 0, 0, 0], 'remaining_budget': 15}
2025-12-08 14:56:53 - DEBUG - Node 4: {'depth': 2, 'occurrences': [0, 0, 1, 0], 'remaining_budget': 13}
2025-12-08 14:56:53 - DEBUG - Bound computed: 14.00 (ceil_knapsack_dp) at depth 2
2025-12-08 14:56:53 - DEBUG -   -> DP solution (remaining): 10.00
2025-12-08 14:56:53 - DEBUG -   -> Already committed: 4.00
2025-12-08 14:56:53 - DEBUG - Node 5: {'depth': 3, 'occurrences': [0, 0, 1, 0], 'remaining_budget': 13}
2025-12-08 14:56:53 - DEBUG - Evaluated leaf node: makespan=4.0
2025-12-08 14:56:53 - DEBUG -   Node: {'depth': 3, 'occurrences': [0, 0, 1, 0], 'remaining_budget': 13}
2025-12-08 14:56:53 - DEBUG - Node 6: {'depth': 2, 'occurrences': [0, 0, 2, 0], 'remaining_budget': 11}
2025-12-08 14:56:53 - DEBUG - Bound computed: 14.00 (ceil_knapsack_dp) at depth 2
2025-12-08 14:56:53 - DEBUG -   -> DP solution (remaining): 10.00
2025-12-08 14:56:53 - DEBUG -   -> Already committed: 4.00
2025-12-08 14:56:53 - DEBUG - Node 7: {'depth': 3, 'occurrences': [0, 0, 2, 0], 'remaining_budget': 11}
2025-12-08 14:56:53 - DEBUG - Evaluated leaf node: makespan=4.0
2025-12-08 14:56:53 - DEBUG -   Node: {'depth': 3, 'occurrences': [0, 0, 2, 0], 'remaining_budget': 11}
2025-12-08 14:56:53 - DEBUG - Node 8: {'depth': 2, 'occurrences': [0, 0, 3, 0], 'remaining_budget': 9}
2025-12-08 14:56:53 - DEBUG - Bound computed: 14.00 (ceil_knapsack_dp) at depth 2
2025-12-08 14:56:53 - DEBUG -   -> DP solution (remaining): 10.00
2025-12-08 14:56:53 - DEBUG -   -> Already committed: 4.00
2025-12-08 14:56:53 - DEBUG - Node 9: {'depth': 3, 'occurrences': [0, 0, 3, 0], 'remaining_budget': 9}
2025-12-08 14:56:53 - DEBUG - Evaluated leaf node: makespan=4.0
2025-12-08 14:56:53 - DEBUG -   Node: {'depth': 3, 'occurrences': [0, 0, 3, 0], 'remaining_budget': 9}
2025-12-08 14:56:53 - DEBUG - Node 10: {'depth': 2, 'occurrences': [0, 0, 4, 0], 'remaining_budget': 7}
2025-12-08 14:56:53 - DEBUG - Bound computed: 14.00 (ceil_knapsack_dp) at depth 2
2025-12-08 14:56:53 - DEBUG -   -> DP solution (remaining): 10.00
2025-12-08 14:56:53 - DEBUG -   -> Already committed: 4.00
2025-12-08 14:56:53 - DEBUG - Node 11: {'depth': 3, 'occurrences': [0, 0, 4, 0], 'remaining_budget': 7}
2025-12-08 14:56:53 - DEBUG - Evaluated leaf node: makespan=4.0
2025-12-08 14:56:53 - DEBUG -   Node: {'depth': 3, 'occurrences': [0, 0, 4, 0], 'remaining_budget': 7}
2025-12-08 14:56:53 - DEBUG - Node 12: {'depth': 2, 'occurrences': [0, 0, 5, 0], 'remaining_budget': 5}
2025-12-08 14:56:53 - DEBUG - Bound computed: 18.00 (ceil_knapsack_dp) at depth 2
2025-12-08 14:56:53 - DEBUG -   -> DP solution (remaining): 10.00
2025-12-08 14:56:53 - DEBUG -   -> Already committed: 8.00
2025-12-08 14:56:53 - DEBUG - Node 13: {'depth': 3, 'occurrences': [0, 0, 5, 0], 'remaining_budget': 5}
2025-12-08 14:56:53 - DEBUG - Evaluated leaf node: makespan=8.0
2025-12-08 14:56:53 - DEBUG -   Node: {'depth': 3, 'occurrences': [0, 0, 5, 0], 'remaining_budget': 5}
2025-12-08 14:56:53 - DEBUG - Node 14: {'depth': 2, 'occurrences': [0, 0, 6, 0], 'remaining_budget': 3}
2025-12-08 14:56:53 - DEBUG - Bound computed: 8.00 (ceil_knapsack_dp) at depth 2
2025-12-08 14:56:53 - DEBUG -   -> DP solution (remaining): 0.00
2025-12-08 14:56:53 - DEBUG -   -> Already committed: 8.00
2025-12-08 14:56:53 - DEBUG - Pruned (bound_dominated): {'depth': 2, 'occurrences': [0, 0, 6, 0], 'remaining_budget': 3}
2025-12-08 14:56:53 - DEBUG - Node 15: {'depth': 2, 'occurrences': [0, 0, 7, 0], 'remaining_budget': 1}
2025-12-08 14:56:53 - DEBUG - Pruned (budget_infeasible): {'depth': 2, 'child_type': 'right'}
2025-12-08 14:56:53 - DEBUG - Bound computed: 8.00 (ceil_knapsack_dp) at depth 2
2025-12-08 14:56:53 - DEBUG -   -> DP solution (remaining): 0.00
2025-12-08 14:56:53 - DEBUG -   -> Already committed: 8.00
2025-12-08 14:56:53 - DEBUG - Pruned (bound_dominated): {'depth': 2, 'occurrences': [0, 0, 7, 0], 'remaining_budget': 1}
2025-12-08 14:56:53 - DEBUG - Node 16: {'depth': 1, 'occurrences': [0, 1, 0, 0], 'remaining_budget': 11}
2025-12-08 14:56:53 - DEBUG - Bound computed: 22.00 (ceil_knapsack_dp) at depth 1
2025-12-08 14:56:53 - DEBUG -   -> DP solution (remaining): 14.00
2025-12-08 14:56:53 - DEBUG -   -> Already committed: 8.00
2025-12-08 14:56:53 - DEBUG - Node 17: {'depth': 2, 'occurrences': [0, 1, 0, 0], 'remaining_budget': 11}
2025-12-08 14:56:53 - DEBUG - Bound computed: 18.00 (ceil_knapsack_dp) at depth 2
2025-12-08 14:56:53 - DEBUG -   -> DP solution (remaining): 10.00
2025-12-08 14:56:53 - DEBUG -   -> Already committed: 8.00
2025-12-08 14:56:53 - DEBUG - Node 18: {'depth': 3, 'occurrences': [0, 1, 0, 0], 'remaining_budget': 11}
2025-12-08 14:56:53 - DEBUG - Evaluated leaf node: makespan=8.0
2025-12-08 14:56:53 - DEBUG -   Node: {'depth': 3, 'occurrences': [0, 1, 0, 0], 'remaining_budget': 11}
2025-12-08 14:56:53 - DEBUG - Node 19: {'depth': 2, 'occurrences': [0, 1, 1, 0], 'remaining_budget': 9}
2025-12-08 14:56:53 - DEBUG - Bound computed: 18.00 (ceil_knapsack_dp) at depth 2
2025-12-08 14:56:53 - DEBUG -   -> DP solution (remaining): 10.00
2025-12-08 14:56:53 - DEBUG -   -> Already committed: 8.00
2025-12-08 14:56:53 - DEBUG - Node 20: {'depth': 3, 'occurrences': [0, 1, 1, 0], 'remaining_budget': 9}
2025-12-08 14:56:53 - DEBUG - Evaluated leaf node: makespan=8.0
2025-12-08 14:56:53 - DEBUG -   Node: {'depth': 3, 'occurrences': [0, 1, 1, 0], 'remaining_budget': 9}
2025-12-08 14:56:53 - DEBUG - Node 21: {'depth': 2, 'occurrences': [0, 1, 2, 0], 'remaining_budget': 7}
2025-12-08 14:56:53 - DEBUG - Bound computed: 18.00 (ceil_knapsack_dp) at depth 2
2025-12-08 14:56:53 - DEBUG -   -> DP solution (remaining): 10.00
2025-12-08 14:56:53 - DEBUG -   -> Already committed: 8.00
2025-12-08 14:56:53 - DEBUG - Node 22: {'depth': 3, 'occurrences': [0, 1, 2, 0], 'remaining_budget': 7}
2025-12-08 14:56:53 - DEBUG - Evaluated leaf node: makespan=8.0
2025-12-08 14:56:53 - DEBUG -   Node: {'depth': 3, 'occurrences': [0, 1, 2, 0], 'remaining_budget': 7}
2025-12-08 14:56:53 - DEBUG - Node 23: {'depth': 2, 'occurrences': [0, 1, 3, 0], 'remaining_budget': 5}
2025-12-08 14:56:53 - DEBUG - Bound computed: 18.00 (ceil_knapsack_dp) at depth 2
2025-12-08 14:56:53 - DEBUG -   -> DP solution (remaining): 10.00
2025-12-08 14:56:53 - DEBUG -   -> Already committed: 8.00
2025-12-08 14:56:53 - DEBUG - Node 24: {'depth': 3, 'occurrences': [0, 1, 3, 0], 'remaining_budget': 5}
2025-12-08 14:56:53 - DEBUG - Evaluated leaf node: makespan=8.0
2025-12-08 14:56:53 - DEBUG -   Node: {'depth': 3, 'occurrences': [0, 1, 3, 0], 'remaining_budget': 5}
2025-12-08 14:56:53 - DEBUG - Node 25: {'depth': 2, 'occurrences': [0, 1, 4, 0], 'remaining_budget': 3}
2025-12-08 14:56:53 - DEBUG - Bound computed: 8.00 (ceil_knapsack_dp) at depth 2
2025-12-08 14:56:53 - DEBUG -   -> DP solution (remaining): 0.00
2025-12-08 14:56:53 - DEBUG -   -> Already committed: 8.00
2025-12-08 14:56:53 - DEBUG - Pruned (bound_dominated): {'depth': 2, 'occurrences': [0, 1, 4, 0], 'remaining_budget': 3}
2025-12-08 14:56:53 - DEBUG - Node 26: {'depth': 2, 'occurrences': [0, 1, 5, 0], 'remaining_budget': 1}
2025-12-08 14:56:53 - DEBUG - Pruned (budget_infeasible): {'depth': 2, 'child_type': 'right'}
2025-12-08 14:56:53 - DEBUG - Bound computed: 8.00 (ceil_knapsack_dp) at depth 2
2025-12-08 14:56:53 - DEBUG -   -> DP solution (remaining): 0.00
2025-12-08 14:56:53 - DEBUG -   -> Already committed: 8.00
2025-12-08 14:56:53 - DEBUG - Pruned (bound_dominated): {'depth': 2, 'occurrences': [0, 1, 5, 0], 'remaining_budget': 1}
2025-12-08 14:56:53 - DEBUG - Node 27: {'depth': 1, 'occurrences': [0, 2, 0, 0], 'remaining_budget': 7}
2025-12-08 14:56:53 - DEBUG - Bound computed: 22.00 (ceil_knapsack_dp) at depth 1
2025-12-08 14:56:53 - DEBUG -   -> DP solution (remaining): 14.00
2025-12-08 14:56:53 - DEBUG -   -> Already committed: 8.00
2025-12-08 14:56:53 - DEBUG - Node 28: {'depth': 2, 'occurrences': [0, 2, 0, 0], 'remaining_budget': 7}
2025-12-08 14:56:53 - DEBUG - Bound computed: 18.00 (ceil_knapsack_dp) at depth 2
2025-12-08 14:56:53 - DEBUG -   -> DP solution (remaining): 10.00
2025-12-08 14:56:53 - DEBUG -   -> Already committed: 8.00
2025-12-08 14:56:53 - DEBUG - Node 29: {'depth': 3, 'occurrences': [0, 2, 0, 0], 'remaining_budget': 7}
2025-12-08 14:56:53 - DEBUG - Evaluated leaf node: makespan=8.0
2025-12-08 14:56:53 - DEBUG -   Node: {'depth': 3, 'occurrences': [0, 2, 0, 0], 'remaining_budget': 7}
2025-12-08 14:56:53 - DEBUG - Node 30: {'depth': 2, 'occurrences': [0, 2, 1, 0], 'remaining_budget': 5}
2025-12-08 14:56:53 - DEBUG - Bound computed: 18.00 (ceil_knapsack_dp) at depth 2
2025-12-08 14:56:53 - DEBUG -   -> DP solution (remaining): 10.00
2025-12-08 14:56:53 - DEBUG -   -> Already committed: 8.00
2025-12-08 14:56:53 - DEBUG - Node 31: {'depth': 3, 'occurrences': [0, 2, 1, 0], 'remaining_budget': 5}
2025-12-08 14:56:53 - DEBUG - Evaluated leaf node: makespan=8.0
2025-12-08 14:56:53 - DEBUG -   Node: {'depth': 3, 'occurrences': [0, 2, 1, 0], 'remaining_budget': 5}
2025-12-08 14:56:53 - DEBUG - Node 32: {'depth': 2, 'occurrences': [0, 2, 2, 0], 'remaining_budget': 3}
2025-12-08 14:56:53 - DEBUG - Bound computed: 8.00 (ceil_knapsack_dp) at depth 2
2025-12-08 14:56:53 - DEBUG -   -> DP solution (remaining): 0.00
2025-12-08 14:56:53 - DEBUG -   -> Already committed: 8.00
2025-12-08 14:56:53 - DEBUG - Pruned (bound_dominated): {'depth': 2, 'occurrences': [0, 2, 2, 0], 'remaining_budget': 3}
2025-12-08 14:56:53 - DEBUG - Node 33: {'depth': 2, 'occurrences': [0, 2, 3, 0], 'remaining_budget': 1}
2025-12-08 14:56:53 - DEBUG - Pruned (budget_infeasible): {'depth': 2, 'child_type': 'right'}
2025-12-08 14:56:53 - DEBUG - Bound computed: 8.00 (ceil_knapsack_dp) at depth 2
2025-12-08 14:56:53 - DEBUG -   -> DP solution (remaining): 0.00
2025-12-08 14:56:53 - DEBUG -   -> Already committed: 8.00
2025-12-08 14:56:53 - DEBUG - Pruned (bound_dominated): {'depth': 2, 'occurrences': [0, 2, 3, 0], 'remaining_budget': 1}
2025-12-08 14:56:53 - DEBUG - Node 34: {'depth': 1, 'occurrences': [0, 3, 0, 0], 'remaining_budget': 3}
2025-12-08 14:56:53 - DEBUG - Pruned (budget_infeasible): {'depth': 1, 'child_type': 'right'}
2025-12-08 14:56:53 - DEBUG - Bound computed: 12.00 (ceil_knapsack_dp) at depth 1
2025-12-08 14:56:53 - DEBUG -   -> DP solution (remaining): 4.00
2025-12-08 14:56:53 - DEBUG -   -> Already committed: 8.00
2025-12-08 14:56:53 - DEBUG - Pruned (bound_dominated): {'depth': 1, 'occurrences': [0, 3, 0, 0], 'remaining_budget': 3}
2025-12-08 14:56:53 - DEBUG - Node 35: {'depth': 0, 'occurrences': [1, 0, 0, 0], 'remaining_budget': 12}
2025-12-08 14:56:53 - DEBUG - Bound computed: 28.00 (ceil_knapsack_dp) at depth 0
2025-12-08 14:56:53 - DEBUG -   -> DP solution (remaining): 22.00
2025-12-08 14:56:53 - DEBUG -   -> Already committed: 6.00
2025-12-08 14:56:53 - DEBUG - Node 36: {'depth': 1, 'occurrences': [1, 0, 0, 0], 'remaining_budget': 12}
2025-12-08 14:56:53 - DEBUG - Bound computed: 20.00 (ceil_knapsack_dp) at depth 1
2025-12-08 14:56:53 - DEBUG -   -> DP solution (remaining): 14.00
2025-12-08 14:56:53 - DEBUG -   -> Already committed: 6.00
2025-12-08 14:56:53 - DEBUG - Node 37: {'depth': 2, 'occurrences': [1, 0, 0, 0], 'remaining_budget': 12}
2025-12-08 14:56:53 - DEBUG - Bound computed: 16.00 (ceil_knapsack_dp) at depth 2
2025-12-08 14:56:53 - DEBUG -   -> DP solution (remaining): 10.00
2025-12-08 14:56:53 - DEBUG -   -> Already committed: 6.00
2025-12-08 14:56:53 - DEBUG - Node 38: {'depth': 3, 'occurrences': [1, 0, 0, 0], 'remaining_budget': 12}
2025-12-08 14:56:53 - DEBUG - Evaluated leaf node: makespan=6.0
2025-12-08 14:56:53 - DEBUG -   Node: {'depth': 3, 'occurrences': [1, 0, 0, 0], 'remaining_budget': 12}
2025-12-08 14:56:53 - DEBUG - Node 39: {'depth': 2, 'occurrences': [1, 0, 1, 0], 'remaining_budget': 10}
2025-12-08 14:56:53 - DEBUG - Bound computed: 16.00 (ceil_knapsack_dp) at depth 2
2025-12-08 14:56:53 - DEBUG -   -> DP solution (remaining): 10.00
2025-12-08 14:56:53 - DEBUG -   -> Already committed: 6.00
2025-12-08 14:56:53 - DEBUG - Node 40: {'depth': 3, 'occurrences': [1, 0, 1, 0], 'remaining_budget': 10}
2025-12-08 14:56:53 - DEBUG - Evaluated leaf node: makespan=6.0
2025-12-08 14:56:53 - DEBUG -   Node: {'depth': 3, 'occurrences': [1, 0, 1, 0], 'remaining_budget': 10}
2025-12-08 14:56:53 - DEBUG - Node 41: {'depth': 2, 'occurrences': [1, 0, 2, 0], 'remaining_budget': 8}
2025-12-08 14:56:53 - DEBUG - Bound computed: 16.00 (ceil_knapsack_dp) at depth 2
2025-12-08 14:56:53 - DEBUG -   -> DP solution (remaining): 10.00
2025-12-08 14:56:53 - DEBUG -   -> Already committed: 6.00
2025-12-08 14:56:53 - DEBUG - Node 42: {'depth': 3, 'occurrences': [1, 0, 2, 0], 'remaining_budget': 8}
2025-12-08 14:56:53 - DEBUG - Evaluated leaf node: makespan=6.0
2025-12-08 14:56:53 - DEBUG -   Node: {'depth': 3, 'occurrences': [1, 0, 2, 0], 'remaining_budget': 8}
2025-12-08 14:56:53 - DEBUG - Node 43: {'depth': 2, 'occurrences': [1, 0, 3, 0], 'remaining_budget': 6}
2025-12-08 14:56:53 - DEBUG - Bound computed: 16.00 (ceil_knapsack_dp) at depth 2
2025-12-08 14:56:53 - DEBUG -   -> DP solution (remaining): 10.00
2025-12-08 14:56:53 - DEBUG -   -> Already committed: 6.00
2025-12-08 14:56:53 - DEBUG - Node 44: {'depth': 3, 'occurrences': [1, 0, 3, 0], 'remaining_budget': 6}
2025-12-08 14:56:53 - DEBUG - Evaluated leaf node: makespan=6.0
2025-12-08 14:56:53 - DEBUG -   Node: {'depth': 3, 'occurrences': [1, 0, 3, 0], 'remaining_budget': 6}
2025-12-08 14:56:53 - DEBUG - Node 45: {'depth': 2, 'occurrences': [1, 0, 4, 0], 'remaining_budget': 4}
2025-12-08 14:56:53 - DEBUG - Bound computed: 8.00 (ceil_knapsack_dp) at depth 2
2025-12-08 14:56:53 - DEBUG -   -> DP solution (remaining): 0.00
2025-12-08 14:56:53 - DEBUG -   -> Already committed: 8.00
2025-12-08 14:56:53 - DEBUG - Pruned (bound_dominated): {'depth': 2, 'occurrences': [1, 0, 4, 0], 'remaining_budget': 4}
2025-12-08 14:56:53 - DEBUG - Node 46: {'depth': 2, 'occurrences': [1, 0, 5, 0], 'remaining_budget': 2}
2025-12-08 14:56:53 - DEBUG - Bound computed: 8.00 (ceil_knapsack_dp) at depth 2
2025-12-08 14:56:53 - DEBUG -   -> DP solution (remaining): 0.00
2025-12-08 14:56:53 - DEBUG -   -> Already committed: 8.00
2025-12-08 14:56:53 - DEBUG - Pruned (bound_dominated): {'depth': 2, 'occurrences': [1, 0, 5, 0], 'remaining_budget': 2}
2025-12-08 14:56:53 - DEBUG - Node 47: {'depth': 2, 'occurrences': [1, 0, 6, 0], 'remaining_budget': 0}
2025-12-08 14:56:53 - DEBUG - Pruned (budget_infeasible): {'depth': 2, 'child_type': 'right'}
2025-12-08 14:56:53 - DEBUG - Bound computed: 8.00 (ceil_knapsack_dp) at depth 2
2025-12-08 14:56:53 - DEBUG -   -> DP solution (remaining): 0.00
2025-12-08 14:56:53 - DEBUG -   -> Already committed: 8.00
2025-12-08 14:56:53 - DEBUG - Pruned (bound_dominated): {'depth': 2, 'occurrences': [1, 0, 6, 0], 'remaining_budget': 0}
2025-12-08 14:56:53 - DEBUG - Node 48: {'depth': 1, 'occurrences': [1, 1, 0, 0], 'remaining_budget': 8}
2025-12-08 14:56:53 - DEBUG - Bound computed: 22.00 (ceil_knapsack_dp) at depth 1
2025-12-08 14:56:53 - DEBUG -   -> DP solution (remaining): 14.00
2025-12-08 14:56:53 - DEBUG -   -> Already committed: 8.00
2025-12-08 14:56:53 - DEBUG - Node 49: {'depth': 2, 'occurrences': [1, 1, 0, 0], 'remaining_budget': 8}
2025-12-08 14:56:53 - DEBUG - Bound computed: 18.00 (ceil_knapsack_dp) at depth 2
2025-12-08 14:56:53 - DEBUG -   -> DP solution (remaining): 10.00
2025-12-08 14:56:53 - DEBUG -   -> Already committed: 8.00
2025-12-08 14:56:53 - DEBUG - Node 50: {'depth': 3, 'occurrences': [1, 1, 0, 0], 'remaining_budget': 8}
2025-12-08 14:56:53 - DEBUG - Evaluated leaf node: makespan=8.0
2025-12-08 14:56:53 - DEBUG -   Node: {'depth': 3, 'occurrences': [1, 1, 0, 0], 'remaining_budget': 8}
2025-12-08 14:56:53 - DEBUG - Node 51: {'depth': 2, 'occurrences': [1, 1, 1, 0], 'remaining_budget': 6}
2025-12-08 14:56:53 - DEBUG - Bound computed: 18.00 (ceil_knapsack_dp) at depth 2
2025-12-08 14:56:53 - DEBUG -   -> DP solution (remaining): 10.00
2025-12-08 14:56:53 - DEBUG -   -> Already committed: 8.00
2025-12-08 14:56:53 - DEBUG - Node 52: {'depth': 3, 'occurrences': [1, 1, 1, 0], 'remaining_budget': 6}
2025-12-08 14:56:53 - DEBUG - Evaluated leaf node: makespan=8.0
2025-12-08 14:56:53 - DEBUG -   Node: {'depth': 3, 'occurrences': [1, 1, 1, 0], 'remaining_budget': 6}
2025-12-08 14:56:53 - DEBUG - Node 53: {'depth': 2, 'occurrences': [1, 1, 2, 0], 'remaining_budget': 4}
2025-12-08 14:56:53 - DEBUG - Bound computed: 8.00 (ceil_knapsack_dp) at depth 2
2025-12-08 14:56:53 - DEBUG -   -> DP solution (remaining): 0.00
2025-12-08 14:56:53 - DEBUG -   -> Already committed: 8.00
2025-12-08 14:56:53 - DEBUG - Pruned (bound_dominated): {'depth': 2, 'occurrences': [1, 1, 2, 0], 'remaining_budget': 4}
2025-12-08 14:56:53 - DEBUG - Node 54: {'depth': 2, 'occurrences': [1, 1, 3, 0], 'remaining_budget': 2}
2025-12-08 14:56:53 - DEBUG - Bound computed: 8.00 (ceil_knapsack_dp) at depth 2
2025-12-08 14:56:53 - DEBUG -   -> DP solution (remaining): 0.00
2025-12-08 14:56:53 - DEBUG -   -> Already committed: 8.00
2025-12-08 14:56:53 - DEBUG - Pruned (bound_dominated): {'depth': 2, 'occurrences': [1, 1, 3, 0], 'remaining_budget': 2}
2025-12-08 14:56:53 - DEBUG - Node 55: {'depth': 2, 'occurrences': [1, 1, 4, 0], 'remaining_budget': 0}
2025-12-08 14:56:53 - DEBUG - Pruned (budget_infeasible): {'depth': 2, 'child_type': 'right'}
2025-12-08 14:56:53 - DEBUG - Bound computed: 8.00 (ceil_knapsack_dp) at depth 2
2025-12-08 14:56:53 - DEBUG -   -> DP solution (remaining): 0.00
2025-12-08 14:56:53 - DEBUG -   -> Already committed: 8.00
2025-12-08 14:56:53 - DEBUG - Pruned (bound_dominated): {'depth': 2, 'occurrences': [1, 1, 4, 0], 'remaining_budget': 0}
2025-12-08 14:56:53 - DEBUG - Node 56: {'depth': 1, 'occurrences': [1, 2, 0, 0], 'remaining_budget': 4}
2025-12-08 14:56:53 - DEBUG - Bound computed: 12.00 (ceil_knapsack_dp) at depth 1
2025-12-08 14:56:53 - DEBUG -   -> DP solution (remaining): 4.00
2025-12-08 14:56:53 - DEBUG -   -> Already committed: 8.00
2025-12-08 14:56:53 - DEBUG - Pruned (bound_dominated): {'depth': 1, 'occurrences': [1, 2, 0, 0], 'remaining_budget': 4}
2025-12-08 14:56:53 - DEBUG - Node 57: {'depth': 1, 'occurrences': [1, 3, 0, 0], 'remaining_budget': 0}
2025-12-08 14:56:53 - DEBUG - Pruned (budget_infeasible): {'depth': 1, 'child_type': 'right'}
2025-12-08 14:56:53 - DEBUG - Bound computed: 8.00 (ceil_knapsack_dp) at depth 1
2025-12-08 14:56:53 - DEBUG -   -> DP solution (remaining): 0.00
2025-12-08 14:56:53 - DEBUG -   -> Already committed: 8.00
2025-12-08 14:56:53 - DEBUG - Pruned (bound_dominated): {'depth': 1, 'occurrences': [1, 3, 0, 0], 'remaining_budget': 0}
2025-12-08 14:56:53 - DEBUG - Node 58: {'depth': 0, 'occurrences': [2, 0, 0, 0], 'remaining_budget': 9}
2025-12-08 14:56:53 - DEBUG - Bound computed: 24.00 (ceil_knapsack_dp) at depth 0
2025-12-08 14:56:53 - DEBUG -   -> DP solution (remaining): 18.00
2025-12-08 14:56:53 - DEBUG -   -> Already committed: 6.00
2025-12-08 14:56:53 - DEBUG - Node 59: {'depth': 1, 'occurrences': [2, 0, 0, 0], 'remaining_budget': 9}
2025-12-08 14:56:53 - DEBUG - Bound computed: 20.00 (ceil_knapsack_dp) at depth 1
2025-12-08 14:56:53 - DEBUG -   -> DP solution (remaining): 14.00
2025-12-08 14:56:53 - DEBUG -   -> Already committed: 6.00
2025-12-08 14:56:53 - DEBUG - Node 60: {'depth': 2, 'occurrences': [2, 0, 0, 0], 'remaining_budget': 9}
2025-12-08 14:56:53 - DEBUG - Bound computed: 16.00 (ceil_knapsack_dp) at depth 2
2025-12-08 14:56:53 - DEBUG -   -> DP solution (remaining): 10.00
2025-12-08 14:56:53 - DEBUG -   -> Already committed: 6.00
2025-12-08 14:56:53 - DEBUG - Node 61: {'depth': 3, 'occurrences': [2, 0, 0, 0], 'remaining_budget': 9}
2025-12-08 14:56:53 - DEBUG - Evaluated leaf node: makespan=6.0
2025-12-08 14:56:53 - DEBUG -   Node: {'depth': 3, 'occurrences': [2, 0, 0, 0], 'remaining_budget': 9}
2025-12-08 14:56:53 - DEBUG - Node 62: {'depth': 2, 'occurrences': [2, 0, 1, 0], 'remaining_budget': 7}
2025-12-08 14:56:53 - DEBUG - Bound computed: 16.00 (ceil_knapsack_dp) at depth 2
2025-12-08 14:56:53 - DEBUG -   -> DP solution (remaining): 10.00
2025-12-08 14:56:53 - DEBUG -   -> Already committed: 6.00
2025-12-08 14:56:53 - DEBUG - Node 63: {'depth': 3, 'occurrences': [2, 0, 1, 0], 'remaining_budget': 7}
2025-12-08 14:56:53 - DEBUG - Evaluated leaf node: makespan=6.0
2025-12-08 14:56:53 - DEBUG -   Node: {'depth': 3, 'occurrences': [2, 0, 1, 0], 'remaining_budget': 7}
2025-12-08 14:56:53 - DEBUG - Node 64: {'depth': 2, 'occurrences': [2, 0, 2, 0], 'remaining_budget': 5}
2025-12-08 14:56:53 - DEBUG - Bound computed: 16.00 (ceil_knapsack_dp) at depth 2
2025-12-08 14:56:53 - DEBUG -   -> DP solution (remaining): 10.00
2025-12-08 14:56:53 - DEBUG -   -> Already committed: 6.00
2025-12-08 14:56:53 - DEBUG - Node 65: {'depth': 3, 'occurrences': [2, 0, 2, 0], 'remaining_budget': 5}
2025-12-08 14:56:53 - DEBUG - Evaluated leaf node: makespan=6.0
2025-12-08 14:56:53 - DEBUG -   Node: {'depth': 3, 'occurrences': [2, 0, 2, 0], 'remaining_budget': 5}
2025-12-08 14:56:53 - DEBUG - Node 66: {'depth': 2, 'occurrences': [2, 0, 3, 0], 'remaining_budget': 3}
2025-12-08 14:56:53 - DEBUG - Bound computed: 8.00 (ceil_knapsack_dp) at depth 2
2025-12-08 14:56:53 - DEBUG -   -> DP solution (remaining): 0.00
2025-12-08 14:56:53 - DEBUG -   -> Already committed: 8.00
2025-12-08 14:56:53 - DEBUG - Pruned (bound_dominated): {'depth': 2, 'occurrences': [2, 0, 3, 0], 'remaining_budget': 3}
2025-12-08 14:56:53 - DEBUG - Node 67: {'depth': 2, 'occurrences': [2, 0, 4, 0], 'remaining_budget': 1}
2025-12-08 14:56:53 - DEBUG - Pruned (budget_infeasible): {'depth': 2, 'child_type': 'right'}
2025-12-08 14:56:53 - DEBUG - Bound computed: 8.00 (ceil_knapsack_dp) at depth 2
2025-12-08 14:56:53 - DEBUG -   -> DP solution (remaining): 0.00
2025-12-08 14:56:53 - DEBUG -   -> Already committed: 8.00
2025-12-08 14:56:53 - DEBUG - Pruned (bound_dominated): {'depth': 2, 'occurrences': [2, 0, 4, 0], 'remaining_budget': 1}
2025-12-08 14:56:53 - DEBUG - Node 68: {'depth': 1, 'occurrences': [2, 1, 0, 0], 'remaining_budget': 5}
2025-12-08 14:56:53 - DEBUG - Bound computed: 18.00 (ceil_knapsack_dp) at depth 1
2025-12-08 14:56:53 - DEBUG -   -> DP solution (remaining): 10.00
2025-12-08 14:56:53 - DEBUG -   -> Already committed: 8.00
2025-12-08 14:56:53 - DEBUG - Node 69: {'depth': 2, 'occurrences': [2, 1, 0, 0], 'remaining_budget': 5}
2025-12-08 14:56:53 - DEBUG - Bound computed: 18.00 (ceil_knapsack_dp) at depth 2
2025-12-08 14:56:53 - DEBUG -   -> DP solution (remaining): 10.00
2025-12-08 14:56:53 - DEBUG -   -> Already committed: 8.00
2025-12-08 14:56:53 - DEBUG - Node 70: {'depth': 3, 'occurrences': [2, 1, 0, 0], 'remaining_budget': 5}
2025-12-08 14:56:53 - DEBUG - Evaluated leaf node: makespan=8.0
2025-12-08 14:56:53 - DEBUG -   Node: {'depth': 3, 'occurrences': [2, 1, 0, 0], 'remaining_budget': 5}
2025-12-08 14:56:53 - DEBUG - Node 71: {'depth': 2, 'occurrences': [2, 1, 1, 0], 'remaining_budget': 3}
2025-12-08 14:56:53 - DEBUG - Bound computed: 8.00 (ceil_knapsack_dp) at depth 2
2025-12-08 14:56:53 - DEBUG -   -> DP solution (remaining): 0.00
2025-12-08 14:56:53 - DEBUG -   -> Already committed: 8.00
2025-12-08 14:56:53 - DEBUG - Pruned (bound_dominated): {'depth': 2, 'occurrences': [2, 1, 1, 0], 'remaining_budget': 3}
2025-12-08 14:56:53 - DEBUG - Node 72: {'depth': 2, 'occurrences': [2, 1, 2, 0], 'remaining_budget': 1}
2025-12-08 14:56:53 - DEBUG - Pruned (budget_infeasible): {'depth': 2, 'child_type': 'right'}
2025-12-08 14:56:53 - DEBUG - Bound computed: 8.00 (ceil_knapsack_dp) at depth 2
2025-12-08 14:56:53 - DEBUG -   -> DP solution (remaining): 0.00
2025-12-08 14:56:53 - DEBUG -   -> Already committed: 8.00
2025-12-08 14:56:53 - DEBUG - Pruned (bound_dominated): {'depth': 2, 'occurrences': [2, 1, 2, 0], 'remaining_budget': 1}
2025-12-08 14:56:53 - DEBUG - Node 73: {'depth': 1, 'occurrences': [2, 2, 0, 0], 'remaining_budget': 1}
2025-12-08 14:56:53 - DEBUG - Pruned (budget_infeasible): {'depth': 1, 'child_type': 'right'}
2025-12-08 14:56:53 - DEBUG - Bound computed: 8.00 (ceil_knapsack_dp) at depth 1
2025-12-08 14:56:53 - DEBUG -   -> DP solution (remaining): 0.00
2025-12-08 14:56:53 - DEBUG -   -> Already committed: 8.00
2025-12-08 14:56:53 - DEBUG - Pruned (bound_dominated): {'depth': 1, 'occurrences': [2, 2, 0, 0], 'remaining_budget': 1}
2025-12-08 14:56:53 - DEBUG - Node 74: {'depth': 0, 'occurrences': [3, 0, 0, 0], 'remaining_budget': 6}
2025-12-08 14:56:53 - DEBUG - Bound computed: 18.00 (ceil_knapsack_dp) at depth 0
2025-12-08 14:56:53 - DEBUG -   -> DP solution (remaining): 12.00
2025-12-08 14:56:53 - DEBUG -   -> Already committed: 6.00
2025-12-08 14:56:53 - DEBUG - Node 75: {'depth': 1, 'occurrences': [3, 0, 0, 0], 'remaining_budget': 6}
2025-12-08 14:56:53 - DEBUG - Bound computed: 16.00 (ceil_knapsack_dp) at depth 1
2025-12-08 14:56:53 - DEBUG -   -> DP solution (remaining): 10.00
2025-12-08 14:56:53 - DEBUG -   -> Already committed: 6.00
2025-12-08 14:56:53 - DEBUG - Node 76: {'depth': 2, 'occurrences': [3, 0, 0, 0], 'remaining_budget': 6}
2025-12-08 14:56:53 - DEBUG - Bound computed: 16.00 (ceil_knapsack_dp) at depth 2
2025-12-08 14:56:53 - DEBUG -   -> DP solution (remaining): 10.00
2025-12-08 14:56:53 - DEBUG -   -> Already committed: 6.00
2025-12-08 14:56:53 - DEBUG - Node 77: {'depth': 3, 'occurrences': [3, 0, 0, 0], 'remaining_budget': 6}
2025-12-08 14:56:53 - DEBUG - Evaluated leaf node: makespan=6.0
2025-12-08 14:56:53 - DEBUG -   Node: {'depth': 3, 'occurrences': [3, 0, 0, 0], 'remaining_budget': 6}
2025-12-08 14:56:53 - DEBUG - Node 78: {'depth': 2, 'occurrences': [3, 0, 1, 0], 'remaining_budget': 4}
2025-12-08 14:56:53 - DEBUG - Bound computed: 6.00 (ceil_knapsack_dp) at depth 2
2025-12-08 14:56:53 - DEBUG -   -> DP solution (remaining): 0.00
2025-12-08 14:56:53 - DEBUG -   -> Already committed: 6.00
2025-12-08 14:56:53 - DEBUG - Pruned (bound_dominated): {'depth': 2, 'occurrences': [3, 0, 1, 0], 'remaining_budget': 4}
2025-12-08 14:56:53 - DEBUG - Node 79: {'depth': 2, 'occurrences': [3, 0, 2, 0], 'remaining_budget': 2}
2025-12-08 14:56:53 - DEBUG - Bound computed: 8.00 (ceil_knapsack_dp) at depth 2
2025-12-08 14:56:53 - DEBUG -   -> DP solution (remaining): 0.00
2025-12-08 14:56:53 - DEBUG -   -> Already committed: 8.00
2025-12-08 14:56:53 - DEBUG - Pruned (bound_dominated): {'depth': 2, 'occurrences': [3, 0, 2, 0], 'remaining_budget': 2}
2025-12-08 14:56:53 - DEBUG - Node 80: {'depth': 2, 'occurrences': [3, 0, 3, 0], 'remaining_budget': 0}
2025-12-08 14:56:53 - DEBUG - Pruned (budget_infeasible): {'depth': 2, 'child_type': 'right'}
2025-12-08 14:56:53 - DEBUG - Bound computed: 10.00 (ceil_knapsack_dp) at depth 2
2025-12-08 14:56:53 - DEBUG -   -> DP solution (remaining): 0.00
2025-12-08 14:56:53 - DEBUG -   -> Already committed: 10.00
2025-12-08 14:56:53 - DEBUG - Pruned (bound_dominated): {'depth': 2, 'occurrences': [3, 0, 3, 0], 'remaining_budget': 0}
2025-12-08 14:56:53 - DEBUG - Node 81: {'depth': 1, 'occurrences': [3, 1, 0, 0], 'remaining_budget': 2}
2025-12-08 14:56:53 - DEBUG - Pruned (budget_infeasible): {'depth': 1, 'child_type': 'right'}
2025-12-08 14:56:53 - DEBUG - Bound computed: 12.00 (ceil_knapsack_dp) at depth 1
2025-12-08 14:56:53 - DEBUG -   -> DP solution (remaining): 4.00
2025-12-08 14:56:53 - DEBUG -   -> Already committed: 8.00
2025-12-08 14:56:53 - DEBUG - Pruned (bound_dominated): {'depth': 1, 'occurrences': [3, 1, 0, 0], 'remaining_budget': 2}
2025-12-08 14:56:53 - DEBUG - Node 82: {'depth': 0, 'occurrences': [4, 0, 0, 0], 'remaining_budget': 3}
2025-12-08 14:56:53 - DEBUG - Bound computed: 10.00 (ceil_knapsack_dp) at depth 0
2025-12-08 14:56:53 - DEBUG -   -> DP solution (remaining): 4.00
2025-12-08 14:56:53 - DEBUG -   -> Already committed: 6.00
2025-12-08 14:56:53 - DEBUG - Pruned (bound_dominated): {'depth': 0, 'occurrences': [4, 0, 0, 0], 'remaining_budget': 3}
2025-12-08 14:56:53 - DEBUG - Node 83: {'depth': 0, 'occurrences': [5, 0, 0, 0], 'remaining_budget': 0}
2025-12-08 14:56:53 - DEBUG - Pruned (budget_infeasible): {'depth': 0, 'child_type': 'right'}
2025-12-08 14:56:53 - DEBUG - Bound computed: 12.00 (ceil_knapsack_dp) at depth 0
2025-12-08 14:56:53 - DEBUG -   -> DP solution (remaining): 0.00
2025-12-08 14:56:53 - DEBUG -   -> Already committed: 12.00
2025-12-08 14:56:53 - DEBUG - Pruned (bound_dominated): {'depth': 0, 'occurrences': [5, 0, 0, 0], 'remaining_budget': 0}
2025-12-08 14:56:53 - INFO - Computing final schedule for best solution...
2025-12-08 14:56:53 - INFO - Metrics saved to: C:\Users\oleda\.vscode\Solving stuff with Gurobi\logs\More Machines_20251208_145653_metrics.json
2025-12-08 14:56:53 - INFO - ============================================================
2025-12-08 14:56:53 - INFO - Branch-and-bound completed
2025-12-08 14:56:53 - INFO - Total runtime: 0.027 seconds
2025-12-08 14:56:53 - INFO - Nodes explored: 83
2025-12-08 14:56:53 - INFO - Nodes pruned: 40
2025-12-08 14:56:53 - INFO - Nodes evaluated: 22
2025-12-08 14:56:53 - INFO - Pruning rate: 48.19%
2025-12-08 14:56:53 - INFO - ============================================================

======================================================================
ENUMERATION COMPARISON
======================================================================
BnB nodes explored: 83
Enumeration nodes evaluated: 83
Ratio (BnB/Enum): 1.00x
Enumeration makespan: 12.0
BnB makespan: 12.0
Match: YES
======================================================================
